<?xml version="1.0" encoding="UTF-8"?><?xml-stylesheet type="text/xsl" href="księgarnia_v1.3_pomocniczy.xsl"?><księgarnia>
<!-- xmlns="http://www.example.org/typyNasze" -->
<!-- xmlns:xsi="http://www.w3.org/2001/XMLSchema-instance"  -->
<!-- xsi:schemaLocation="http://www.example.org/typyNasze księgarnia_v1.3.xsd" > --> 
    
	
	<lista_kategorii>
		<kategoria>
			<nazwa>Psychologia</nazwa>
		</kategoria>
		<kategoria>
			<nazwa>Thriller</nazwa>
		</kategoria>
		<kategoria>
			<nazwa>Fantastyka</nazwa>
		</kategoria>
		<kategoria>
			<nazwa>Poradniki</nazwa>
		</kategoria>
	</lista_kategorii>
	
   
			<książka>
			    <!-- Rodzaje: książka, czasopismo, itp-->				
                <tytuł>Dziewczyna z pociągu</tytuł>
				<język>polski</język>
				<ISBN>9788380316904</ISBN>
				<ilość_stron>365</ilość_stron>
				<wydanie>
				    <miejsce_wydania>Warszawa</miejsce_wydania>   
				    <data_wydania>2016-09-28</data_wydania>
				</wydanie>
                <wydawnictwo>Świat Książki</wydawnictwo>
                <cena waluta="USD">27.64</cena>
                
            <cenaPLN>110.56</cenaPLN>
		<Autorzy>
			<autor IdAutora="PH">
	<imięPierwsze>Paula</imięPierwsze>
	<nazwisko>Hawkins</nazwisko>
	</autor>
		</Autorzy>
		<kategoria IdKategorii="PSYCH">
			<nazwa>Psychologia</nazwa>
		</kategoria>
	</książka>
			
			<książka>
			<tytuł>Ofiara losu</tytuł>
			<język>polski</język>
				<ISBN> 9788380154742</ISBN>
				<ilość_stron>587</ilość_stron>
				<wydanie>
				    <miejsce_wydania>Warszawa</miejsce_wydania>   
				    <data_wydania>2016-09-28</data_wydania>
				</wydanie>
                <wydawnictwo>Czarna Owca</wydawnictwo>
                <cena waluta="PLN">18.68</cena>
                
            <cenaPLN>18.68</cenaPLN>
		<Autorzy>
			<autor IdAutora="CL">
	<imięPierwsze>Cmilla</imięPierwsze>
	<nazwisko>Christie</nazwisko>	
	</autor>
		</Autorzy>
		<kategoria IdKategorii="PSYCH">
			<nazwa>Psychologia</nazwa>
		</kategoria>
	</książka>
			
			<książka>
                <tytuł>Psychologia i życie</tytuł>
				<język>polski</język>
				<ISBN>9788301172572</ISBN>
				<ilość_stron>658</ilość_stron>
				<wydanie>
				    <miejsce_wydania>Warszawa</miejsce_wydania>   
				    <data_wydania>2008-01-10</data_wydania>
				</wydanie>
                <wydawnictwo>Polskie Wwydawnictwo Naukowe</wydawnictwo>
                <cena waluta="PLN">107.28</cena>
                
            <cenaPLN>107.28</cenaPLN>
		<Autorzy>
			<autor IdAutora="PGZ">
	<imięPierwsze>Philip</imięPierwsze>
	<imięDrugie>G</imięDrugie>
	<nazwisko>Zimbardo</nazwisko>
	</autor>
			<autor IdAutora="RJG">
	<imięPierwsze>Richard</imięPierwsze>
	<imięDrugie>J</imięDrugie>
	<nazwisko>Gerrig</nazwisko>
	</autor>
		</Autorzy>
		<kategoria IdKategorii="PSYCH">
			<nazwa>Psychologia</nazwa>
		</kategoria>
	</książka>
			
			<e-book>
			    <tytuł>Dopóki starczy światła</tytuł>
				<język>polski</język>
				<ISBN>9788324592821</ISBN>
				<rozmiar>35</rozmiar>
				<wydanie>
				    <miejsce_wydania>Wrocław</miejsce_wydania>   
				    <data_wydania>2012-09-28</data_wydania>
				</wydanie>
                <wydawnictwo>Dolnośląskie</wydawnictwo>
                <cena waluta="EUR">15.57</cena>
                
            <cenaPLN>70.065</cenaPLN>
		<Autorzy>
			<autor IdAutora="AC">
	<imięPierwsze>Agata</imięPierwsze>
	<nazwisko>Christie</nazwisko>
	</autor>
		</Autorzy>
		<kategoria IdKategorii="PSYCH">
			<nazwa>Psychologia</nazwa>
		</kategoria>
	</e-book>
			
          	
			<czasopismo>
			    <tytuł>Montecristo</tytuł>
				<język>polski</język>
				<ISBN>9788380620896</ISBN>
				<częstotliwość>miesięcznik</częstotliwość>
				<wydanie>
				    <miejsce_wydania>Poznań</miejsce_wydania>   
				    <data_wydania>2016-09-28</data_wydania>
				</wydanie>
                <wydawnictwo>Redis</wydawnictwo>
                <cena waluta="PLN">27.92</cena>
                
            <cenaPLN>27.92</cenaPLN>
		<Autorzy>
			<autor IdAutora="MS">
	<imięPierwsze>Martin</imięPierwsze>
	<nazwisko>Suter-Suter</nazwisko>
	</autor>
		</Autorzy>
		<kategoria IdKategorii="POR">
			<nazwa>Poradniki</nazwa>
		</kategoria>
	</czasopismo>
			
			
			<e-book>
                <tytuł>Tajemnica Sittaford</tytuł>
				<język>polski</język>
				<ISBN>  9788324587933</ISBN>
				<rozmiar>85</rozmiar>
				<wydanie>
				    <miejsce_wydania>Wrocław</miejsce_wydania>   
				    <data_wydania>2010-09-28</data_wydania>
				</wydanie>
                <wydawnictwo>Dolnośląskie</wydawnictwo>
                <cena waluta="EUR">12.74</cena>
                
            <cenaPLN>57.33</cenaPLN>
		<Autorzy>
			<autor IdAutora="AC">
	<imięPierwsze>Agata</imięPierwsze>
	<nazwisko>Christie</nazwisko>
	</autor>
		</Autorzy>
		<kategoria IdKategorii="PSYCH">
			<nazwa>Psychologia</nazwa>
		</kategoria>
	</e-book>			
    	
	
   
            
    
	
	
            <książka>
                <tytuł>Opowieści z Narnii Lew, Czarownica i stara szafa</tytuł>
				<język>polski</język>
				<ISBN>9788372781758</ISBN>
				<ilość_stron>225</ilość_stron>
				<wydanie>
				    <miejsce_wydania>Poznań</miejsce_wydania>   
				    <data_wydania>2016-09-28</data_wydania>
				</wydanie>
                <wydawnictwo>Media Rodzina</wydawnictwo>
                <cena waluta="PLN">14.26</cena>
                
            <cenaPLN>14.26</cenaPLN>
		<Autorzy>
			<autor IdAutora="CSL">
	<imięPierwsze>Cristian</imięPierwsze>
	<imięDrugie>S</imięDrugie>
	<nazwisko>Levis</nazwisko>
	</autor>
		</Autorzy>
		<kategoria IdKategorii="FAN">
			<nazwa>Fantastyka</nazwa>
		</kategoria>
	</książka>
			<e-book>
                <tytuł>Ostatnia bitwa</tytuł>
				<język>polski</język>
				<ISBN>9788372788832</ISBN>
				<rozmiar>48</rozmiar>
				<wydanie>
				    <miejsce_wydania>Poznań</miejsce_wydania>   
				    <data_wydania>2013-09-28</data_wydania>
				</wydanie>
                <wydawnictwo>Media Rodzina</wydawnictwo>
                <cena waluta="PLN">14.31</cena>
                
            <cenaPLN>14.31</cenaPLN>
		<Autorzy>
			<autor IdAutora="CSL">
	<imięPierwsze>Cristian</imięPierwsze>
	<imięDrugie>S</imięDrugie>
	<nazwisko>Levis</nazwisko>
	</autor>
		</Autorzy>
		<kategoria IdKategorii="FAN">
			<nazwa>Fantastyka</nazwa>
		</kategoria>
	</e-book>
			<czasopismo>
                <tytuł>Książę Kaspian</tytuł>
				<język>polski</język>
				<ISBN>9788372788788</ISBN>
				<częstotliwość>tygodnik</częstotliwość>
				<wydanie>
				    <miejsce_wydania>Poznań</miejsce_wydania>   
				    <data_wydania>2013-09-28</data_wydania>
				</wydanie>
                <wydawnictwo>Media Rodzina</wydawnictwo>
                <cena waluta="PLN">15.65</cena>
                
            <cenaPLN>15.65</cenaPLN>
		<Autorzy>
			<autor IdAutora="CSL">
	<imięPierwsze>Cristian</imięPierwsze>
	<imięDrugie>S</imięDrugie>
	<nazwisko>Levis</nazwisko>
	</autor>
		</Autorzy>
		<kategoria IdKategorii="FAN">
			<nazwa>Fantastyka</nazwa>
		</kategoria>
	</czasopismo>
			<książka>
                <tytuł>Siostrzeniec Czarodzieja</tytuł>
				<język>polski</język>
				<ISBN>9788372788825</ISBN>
				<ilość_stron>259</ilość_stron>
				<wydanie>
				    <miejsce_wydania>Poznań</miejsce_wydania>   
				    <data_wydania>2013-09-28</data_wydania>
				</wydanie>
                <wydawnictwo>Media Rodzina</wydawnictwo>
                <cena waluta="PLN">14.31</cena>
                
            <cenaPLN>14.31</cenaPLN>
		<Autorzy>
			<autor IdAutora="CSL">
	<imięPierwsze>Cristian</imięPierwsze>
	<imięDrugie>S</imięDrugie>
	<nazwisko>Levis</nazwisko>
	</autor>
		</Autorzy>
		<kategoria IdKategorii="FAN">
			<nazwa>Fantastyka</nazwa>
		</kategoria>
	</książka>
			<książka>
                <tytuł>Lśnienie</tytuł>
				<język>polski</język>
				<ISBN>9788376488097</ISBN>
				<ilość_stron>259</ilość_stron>
				<wydanie>
				    <miejsce_wydania>Warszawa</miejsce_wydania>   
				    <data_wydania>2015-09-28</data_wydania>
				</wydanie>
                <wydawnictwo>Prószyński Media</wydawnictwo>
                <cena waluta="USD">9.31</cena>
                
            <cenaPLN>37.24</cenaPLN>
		<Autorzy>
			<autor IdAutora="SK">
	<imięPierwsze>Stephen</imięPierwsze>
	<nazwisko>King</nazwisko>	
	</autor>
		</Autorzy>
		<kategoria IdKategorii="FAN">
			<nazwa>Fantastyka</nazwa>
		</kategoria>
	</książka>
    
	
	<książka>
	<tytuł>Dieta dla aktywnych</tytuł>
				<język>polski</język>
				<ISBN>9788364131165</ISBN>
				<ilość_stron>259</ilość_stron>
				<wydanie>
				    <miejsce_wydania>Poznań</miejsce_wydania>   
				    <data_wydania>2016-09-28</data_wydania>
				</wydanie>
                <wydawnictwo>Buk Rower</wydawnictwo>
                <cena waluta="PLN">25.50</cena>
                
	<cenaPLN>25.50</cenaPLN>
		<Autorzy>
			<autor IdAutora="LC">
	<imięPierwsze>Lorel</imięPierwsze>
	<nazwisko>Cordial</nazwisko>	
	</autor>
		</Autorzy>
		<kategoria IdKategorii="POR">
			<nazwa>Poradniki</nazwa>
		</kategoria>
	</książka>
		<książka>
				<tytuł>Jedz i trenuj</tytuł>
				<język>polski</język>
				<ISBN>9788364131172</ISBN>
				<ilość_stron>259</ilość_stron>
				<wydanie>
				    <miejsce_wydania>Poznań</miejsce_wydania>   
				    <data_wydania>2015-09-28</data_wydania>
				</wydanie>
                <wydawnictwo>Buk Rower</wydawnictwo>
                <cena waluta="PLN">37.43</cena>
                
	<cenaPLN>37.43</cenaPLN>
		<Autorzy>
			<autor IdAutora="NC">
	<imięPierwsze>Nancy</imięPierwsze>
	<nazwisko>Clark</nazwisko>	
	</autor>
		</Autorzy>
		<kategoria IdKategorii="POR">
			<nazwa>Poradniki</nazwa>
		</kategoria>
	</książka>
	<książka>
				<tytuł>Pływanie dla każdego</tytuł>
				<język>polski</język>
				<ISBN>9788392638704</ISBN>
				<ilość_stron>259</ilość_stron>
				<wydanie>
				    <miejsce_wydania>Zielonka</miejsce_wydania>   
				    <data_wydania>2013-09-28</data_wydania>
				</wydanie>
                <wydawnictwo>Buk Rower</wydawnictwo>
                <cena waluta="PLN">21.56</cena>
                
	<cenaPLN>21.56</cenaPLN>
		<Autorzy>
			<autor IdAutora="TL">